{
  "schema_version": 1,
  "project": {
    "name": "example-wordpress-project",
    "owner": "content-owner"
  },
  "target": {
    "environment": "staging",
    "canonical_urls": ["https://staging.example.test"],
    "fingerprint": {
      "provider": "approved-host",
      "compose_project": "example-staging",
      "service": "wordpress",
      "wordpress_site_url": "https://staging.example.test",
      "table_prefix": "wp_"
    }
  },
  "source": {
    "repository": "example-wordpress-project",
    "revision": "0000000000000000000000000000000000000000",
    "truth_register": ["approved-content-register.md"]
  },
  "runtime": {
    "adapter": "rest",
    "wp_cli": "available",
    "database": {
      "identity": "example-staging-db",
      "table_prefix": "wp_"
    }
  },
  "wordpress": {
    "core_version": "7.0.2",
    "multisite": false,
    "theme": "example-child-theme",
    "plugins": ["example-seo"]
  },
  "verification": {
    "channels": ["rest", "authenticated-browser", "logged-out-browser"],
    "known_blockers": []
  },
  "change": {
    "state": "planned",
    "approval": "issue-56-review",
    "managed_objects": ["page:123"]
  }
}
